[
  {
    "edge_id": "EDGE-REMEDY-CLASSIFY-CORAM",
    "from_node": "NODE-POSTCONVICTION-REMEDY-CLASSIFICATION",
    "to_node": "NODE-CORAM-NOBIS-SCREEN",
    "relationship": "may_lead_to",
    "condition": "qualifying custody under the challenged federal conviction has ended and conviction consequences plus a fundamental defect are asserted",
    "claim_ids": [
      "CLM-XWRIT-016",
      "CLM-XWRIT-018"
    ]
  },
  {
    "edge_id": "EDGE-CORAM-SCREEN-FILING",
    "from_node": "NODE-CORAM-NOBIS-SCREEN",
    "to_node": "NODE-CORAM-NOBIS-FILING",
    "relationship": "permits",
    "condition": "Morgan minimums and every controlling-circuit requirement are supportable",
    "claim_ids": [
      "CLM-XWRIT-008",
      "CLM-XWRIT-009",
      "CLM-XWRIT-010",
      "CLM-XWRIT-011",
      "CLM-XWRIT-012",
      "CLM-XWRIT-014",
      "CLM-XWRIT-015"
    ]
  },
  {
    "edge_id": "EDGE-CORAM-SCREEN-NO-REMEDY",
    "from_node": "NODE-CORAM-NOBIS-SCREEN",
    "to_node": "NODE-NO-EXTRAORDINARY-JUDICIAL-REMEDY",
    "relationship": "bars",
    "condition": "a required coram nobis gate is not met and no other supported vehicle exists",
    "claim_ids": [
      "CLM-XWRIT-009",
      "CLM-XWRIT-010",
      "CLM-XWRIT-011",
      "CLM-XWRIT-016"
    ]
  },
  {
    "edge_id": "EDGE-REMEDY-CLASSIFY-AUDITA",
    "from_node": "NODE-POSTCONVICTION-REMEDY-CLASSIFICATION",
    "to_node": "NODE-AUDITA-QUERELA-SCREEN",
    "relationship": "may_lead_to",
    "condition": "a postjudgment defense is asserted and no governing statutory vehicle has yet been identified",
    "claim_ids": [
      "CLM-XWRIT-020",
      "CLM-XWRIT-021",
      "CLM-XWRIT-025"
    ]
  },
  {
    "edge_id": "EDGE-AUDITA-STATUTORY-VEHICLE-BAR",
    "from_node": "NODE-AUDITA-QUERELA-SCREEN",
    "to_node": "NODE-NO-EXTRAORDINARY-JUDICIAL-REMEDY",
    "relationship": "bars",
    "condition": "the claim is cognizable under § 2255 or only § 2255 restrictions or nonretroactivity are asserted as the gap under applicable law",
    "claim_ids": [
      "CLM-XWRIT-022",
      "CLM-XWRIT-023",
      "CLM-XWRIT-024",
      "CLM-XWRIT-025"
    ]
  },
  {
    "edge_id": "EDGE-REMEDY-CLASSIFY-MANDAMUS",
    "from_node": "NODE-POSTCONVICTION-REMEDY-CLASSIFICATION",
    "to_node": "NODE-MANDAMUS-CLASSIFICATION",
    "relationship": "may_lead_to",
    "condition": "relief seeks performance of a clear duty and no adequate ordinary remedy is available",
    "claim_ids": [
      "CLM-XWRIT-026",
      "CLM-XWRIT-027",
      "CLM-XWRIT-028",
      "CLM-XWRIT-029"
    ]
  },
  {
    "edge_id": "EDGE-MANDAMUS-CLASSIFY-APPELLATE",
    "from_node": "NODE-MANDAMUS-CLASSIFICATION",
    "to_node": "NODE-MANDAMUS-APPELLATE-FILING",
    "relationship": "permits",
    "condition": "the appropriate court of appeals is asked to issue a writ in aid of its jurisdiction and Cheney and Rule 21 can be satisfied",
    "claim_ids": [
      "CLM-XWRIT-026",
      "CLM-XWRIT-029",
      "CLM-XWRIT-030",
      "CLM-XWRIT-031",
      "CLM-XWRIT-032",
      "CLM-XWRIT-033"
    ]
  },
  {
    "edge_id": "EDGE-MANDAMUS-CLASSIFY-DISTRICT",
    "from_node": "NODE-MANDAMUS-CLASSIFICATION",
    "to_node": "NODE-MANDAMUS-DISTRICT-FILING",
    "relationship": "permits",
    "condition": "§ 1361 jurisdiction, a federal officer or agency, clear nondiscretionary duty, and exhaustion of other avenues can be shown",
    "claim_ids": [
      "CLM-XWRIT-027",
      "CLM-XWRIT-028"
    ]
  },
  {
    "edge_id": "EDGE-REMEDY-CLASSIFY-CLEMENCY",
    "from_node": "NODE-POSTCONVICTION-REMEDY-CLASSIFICATION",
    "to_node": "NODE-CLEMENCY-CLASSIFICATION",
    "relationship": "may_lead_to",
    "condition": "executive mercy rather than judicial correction is requested for a qualifying federal offense",
    "claim_ids": [
      "CLM-CLEM-002",
      "CLM-CLEM-004",
      "CLM-CLEM-007"
    ]
  },
  {
    "edge_id": "EDGE-CLEMENCY-CLASSIFY-PARDON",
    "from_node": "NODE-CLEMENCY-CLASSIFICATION",
    "to_node": "NODE-PARDON-PETITION",
    "relationship": "permits",
    "condition": "pardon is the requested form and current advisory timing and form requirements are addressed",
    "claim_ids": [
      "CLM-CLEM-008",
      "CLM-CLEM-009",
      "CLM-CLEM-010",
      "CLM-CLEM-011"
    ]
  },
  {
    "edge_id": "EDGE-CLEMENCY-CLASSIFY-COMMUTATION",
    "from_node": "NODE-CLEMENCY-CLASSIFICATION",
    "to_node": "NODE-COMMUTATION-PETITION",
    "relationship": "permits",
    "condition": "reduction of a sentence being served is requested and current form and other-remedy guidance are addressed",
    "claim_ids": [
      "CLM-CLEM-008",
      "CLM-CLEM-012",
      "CLM-CLEM-027"
    ]
  },
  {
    "edge_id": "EDGE-PARDON-PETITION-PRESIDENT",
    "from_node": "NODE-PARDON-PETITION",
    "to_node": "NODE-CLEMENCY-PRESIDENTIAL-DECISION",
    "relationship": "may_lead_to",
    "condition": "advisory DOJ review and recommendation proceed to presidential decision",
    "claim_ids": [
      "CLM-CLEM-013",
      "CLM-CLEM-014",
      "CLM-CLEM-017",
      "CLM-CLEM-018"
    ]
  },
  {
    "edge_id": "EDGE-COMMUTATION-PETITION-PRESIDENT",
    "from_node": "NODE-COMMUTATION-PETITION",
    "to_node": "NODE-CLEMENCY-PRESIDENTIAL-DECISION",
    "relationship": "may_lead_to",
    "condition": "advisory DOJ review and recommendation proceed to presidential decision",
    "claim_ids": [
      "CLM-CLEM-013",
      "CLM-CLEM-014",
      "CLM-CLEM-017",
      "CLM-CLEM-018"
    ]
  },
  {
    "edge_id": "EDGE-SENTMOD-CLASSIFY-RULE35A",
    "from_node": "NODE-SENTENCE-MODIFICATION-CLASSIFICATION",
    "to_node": "NODE-RULE35A-SCREEN",
    "relationship": "may_lead_to",
    "condition": "a qualifying clear sentencing error is asserted",
    "claim_ids": [
      "CLM-R3536-003",
      "CLM-R3536-004"
    ]
  },
  {
    "edge_id": "EDGE-SENTMOD-CLASSIFY-RULE35B",
    "from_node": "NODE-SENTENCE-MODIFICATION-CLASSIFICATION",
    "to_node": "NODE-RULE35B-GOVERNMENT-MOTION-SCREEN",
    "relationship": "may_lead_to",
    "condition": "a government substantial-assistance motion is or may be available",
    "claim_ids": [
      "CLM-R3536-003",
      "CLM-R3536-013",
      "CLM-R3536-014"
    ]
  },
  {
    "edge_id": "EDGE-SENTMOD-CLASSIFY-RULE36",
    "from_node": "NODE-SENTENCE-MODIFICATION-CLASSIFICATION",
    "to_node": "NODE-RULE36-SCREEN",
    "relationship": "may_lead_to",
    "condition": "a clerical judgment, order, or record error is asserted",
    "claim_ids": [
      "CLM-R3536-003",
      "CLM-R3536-026",
      "CLM-R3536-027"
    ]
  },
  {
    "edge_id": "EDGE-SENTMOD-CLASSIFY-CRACK",
    "from_node": "NODE-SENTENCE-MODIFICATION-CLASSIFICATION",
    "to_node": "NODE-CRACK-REDUCTION-CLASSIFICATION",
    "relationship": "may_lead_to",
    "condition": "later crack-cocaine relief is requested",
    "claim_ids": [
      "CLM-R3536-034"
    ]
  },
  {
    "edge_id": "EDGE-RULE35A-SCREEN-CORRECTION",
    "from_node": "NODE-RULE35A-SCREEN",
    "to_node": "NODE-RULE35A-CORRECTION",
    "relationship": "permits",
    "condition": "the court acts within fourteen days on qualifying narrow clear error",
    "claim_ids": [
      "CLM-R3536-004",
      "CLM-R3536-006",
      "CLM-R3536-009",
      "CLM-R3536-012"
    ]
  },
  {
    "edge_id": "EDGE-RULE35B-SCREEN-REDUCTION",
    "from_node": "NODE-RULE35B-GOVERNMENT-MOTION-SCREEN",
    "to_node": "NODE-RULE35B-REDUCTION",
    "relationship": "permits",
    "condition": "a government motion satisfies the applicable timing and substantial-assistance route",
    "claim_ids": [
      "CLM-R3536-014",
      "CLM-R3536-015",
      "CLM-R3536-016",
      "CLM-R3536-017",
      "CLM-R3536-020"
    ]
  },
  {
    "edge_id": "EDGE-RULE36-SCREEN-CORRECTION",
    "from_node": "NODE-RULE36-SCREEN",
    "to_node": "NODE-RULE36-CORRECTION",
    "relationship": "permits",
    "condition": "record proof supports a clerical rather than substantive correction",
    "claim_ids": [
      "CLM-R3536-027",
      "CLM-R3536-028",
      "CLM-R3536-029",
      "CLM-R3536-030"
    ]
  },
  {
    "edge_id": "EDGE-RULE35A-CORRECTION-ORDER",
    "from_node": "NODE-RULE35A-CORRECTION",
    "to_node": "NODE-SENTENCE-MODIFICATION-ORDER",
    "relationship": "next",
    "condition": "the court grants or denies Rule 35(a) relief",
    "claim_ids": [
      "CLM-R3536-012"
    ]
  },
  {
    "edge_id": "EDGE-RULE35B-REDUCTION-ORDER",
    "from_node": "NODE-RULE35B-REDUCTION",
    "to_node": "NODE-SENTENCE-MODIFICATION-ORDER",
    "relationship": "next",
    "condition": "the court grants or denies the government Rule 35(b) motion",
    "claim_ids": [
      "CLM-R3536-020",
      "CLM-R3536-025"
    ]
  },
  {
    "edge_id": "EDGE-RULE36-CORRECTION-ORDER",
    "from_node": "NODE-RULE36-CORRECTION",
    "to_node": "NODE-SENTENCE-MODIFICATION-ORDER",
    "relationship": "next",
    "condition": "the court corrects the record or denies Rule 36 relief",
    "claim_ids": [
      "CLM-R3536-029",
      "CLM-R3536-033"
    ]
  },
  {
    "edge_id": "EDGE-CRACK-CLASSIFICATION-ORDER",
    "from_node": "NODE-CRACK-REDUCTION-CLASSIFICATION",
    "to_node": "NODE-SENTENCE-MODIFICATION-ORDER",
    "relationship": "may_lead_to",
    "condition": "the correct § 404 or § 3582(c)(2) route is eligible and adjudicated",
    "claim_ids": [
      "CLM-R3536-035",
      "CLM-R3536-036",
      "CLM-R3536-037"
    ]
  },
  {
    "edge_id": "EDGE-SENTMOD-ORDER-APPEAL",
    "from_node": "NODE-SENTENCE-MODIFICATION-ORDER",
    "to_node": "NODE-SENTENCE-MODIFICATION-APPEAL",
    "relationship": "appeals_to",
    "condition": "an authorized party timely appeals and the asserted jurisdictional basis applies",
    "claim_ids": [
      "CLM-R3536-038",
      "CLM-R3536-039",
      "CLM-R3536-040",
      "CLM-R3536-041",
      "CLM-R3536-044"
    ]
  },
  {
    "edge_id": "EDGE-BOP-CLASSIFY-COMPUTATION",
    "from_node": "NODE-BOP-EXECUTION-CLASSIFICATION",
    "to_node": "NODE-BOP-SENTENCE-COMPUTATION",
    "relationship": "may_lead_to",